{
  "$schema": "../../resume.schema.json",
  "lang": "it",
  "name": "Liu Zhong Li",
  "headline": "Full-Stack Software Developer",
  "documentTitle": "Liu Zhong Li - Full-Stack Software Developer",
  "density": "compact",
  "contact": ["+39 347 629 6739", "Calusco d'Adda (BG), Italia"],
  "links": [
    { "label": "liuzhongli.ascii@gmail.com", "href": "mailto:liuzhongli.ascii@gmail.com" },
    { "label": "kukutx.vercel.app", "href": "https://kukutx.vercel.app" },
    { "label": "LinkedIn", "href": "https://www.linkedin.com/in/zhongliliu" },
    { "label": "GitHub", "href": "https://github.com/Kukutx" }
  ],
  "sections": [
    {
      "type": "text",
      "title": "Profilo",
      "paragraphs": [
        "Sviluppatore full-stack con esperienza professionale nello sviluppo di applicazioni web e mobile, principalmente con C#/.NET (ASP.NET Core, Entity Framework Core), React/Next.js, Flutter, SQL Server e PostgreSQL. Da dicembre 2025 sviluppo in autonomia Crew, dalla UX/UI al cloud fino alla pubblicazione su Google Play e App Store."
      ]
    },
    {
      "type": "entries",
      "title": "Esperienza professionale",
      "entries": [
        {
          "title": "Crew",
          "subtitle": "Full-Stack Software Developer (progetto indipendente)",
          "date": "dic 2025 — presente",
          "meta": "[crew-app.com](https://www.crew-app.com/) • [Google Play](https://play.google.com/store/apps/details?id=app.crew) • [App Store](https://apps.apple.com/app/id6812583779) • in produzione da giu 2026",
          "bullets": [
            "Progettazione e sviluppo end-to-end: UX/UI, backend ASP.NET Core con Entity Framework Core, app Flutter, sito web e pannello di amministrazione in Next.js, database PostgreSQL/PostGIS.",
            "Clean Architecture con pattern CQRS: pipeline con validazione, transazioni e idempotenza dei comandi, transactional outbox, job in background e schedulati, caching e rate limiting su Redis.",
            "Funzionalità principali: eventi Spot e Route, chat in tempo reale con SignalR, notifiche push, autenticazione, pagamenti con Stripe Connect (rimborsi e payout agli organizzatori), gestione e moderazione di utenti e contenuti.",
            "Infrastruttura dev/prod su Google Cloud (Cloud Run, Cloud SQL), Firebase e Vercel; CI/CD con GitHub Actions fino al rilascio automatico delle app; test automatici (xUnit, Testcontainers) e client API generati da OpenAPI.",
            "Pubblicazione su **Google Play** e **App Store**, con i primi utenti reali e flussi di pagamento validati in produzione."
          ]
        },
        {
          "title": "Hinge 16 S.r.l.",
          "subtitle": "Software Developer",
          "date": "lug 2024 — set 2025",
          "bullets": [
            "Interventi su progetti di aziende clienti: sviluppo e manutenzione evolutiva di Web API .NET, manutenzione di pannelli di amministrazione Vue, applicazioni .NET/Blazor MAUI, Odoo e Azure AI Services, con test e documentazione.",
            "Sviluppo e manutenzione in autonomia di siti WordPress/Elementor ed e-commerce WooCommerce/Stripe, dalla correzione dei bug ai controlli prima della consegna interna."
          ]
        },
        {
          "title": "Gruppo Maggioli",
          "subtitle": "Junior PHP / Drupal Developer",
          "date": "gen 2024 — mag 2024",
          "bullets": [
            "Sviluppo e manutenzione dello Sportello Telematico Polifunzionale con Drupal, PHP e JavaScript, utilizzando Git, Docker, Jira, PHPStan/PHPCS e automazioni; prime esperienze con Kubernetes."
          ]
        },
        {
          "title": "Reti S.p.A.",
          "subtitle": "Junior Angular Developer",
          "date": "mag 2023 — set 2023",
          "bullets": [
            "Sviluppo frontend di RetiSkills con Angular, Angular Material e Bootstrap: componenti e servizi, integrazione con ASP.NET Web API e SQL Server, UI/UX in Figma e bug fixing in team su Azure DevOps."
          ]
        }
      ]
    },
    {
      "type": "entries",
      "title": "Progetti selezionati",
      "entries": [
        {
          "title": "DevMate — Runtime MCP local-first",
          "href": "https://github.com/Kukutx/DevMate",
          "badge": "Open source · MIT",
          "date": "giu 2026 — presente",
          "bullets": [
            "Collega ChatGPT e Claude a workspace controllati; pubblicato su VS Code Marketplace e come plugin Obsidian, con CLI.",
            "OAuth/PKCE, job persistenti (SQLite), delega ad agenti locali (Codex, Claude Code) e registro degli eventi."
          ]
        },
        {
          "title": "TradePilot 212 — App MCP self-hosted",
          "href": "https://github.com/Kukutx/TradePilot212",
          "badge": "Open source · MIT",
          "date": "set 2026 — presente",
          "bullets": [
            "Collega ChatGPT e Claude a Trading 212 con UI del portafoglio, preparazione degli ordini e integrazione con le API Demo/Live.",
            "OAuth/PKCE, Cloudflare Workers/Durable Objects e conferma esplicita degli ordini; nessun retry automatico se l'esito è ambiguo."
          ]
        }
      ]
    },
    {
      "type": "entries",
      "title": "Formazione",
      "entries": [
        {
          "title": "ITS Incom",
          "subtitle": "Tecnico Superiore (EQF 5), Cloud Developer",
          "date": "2022 — 2024",
          "bullets": [
            "Percorso biennale orientato allo sviluppo software e alle tecnologie cloud: applicazioni full-stack con back-end ASP.NET Web API e front-end Angular o Flutter, infrastrutture su Azure e Azure DevOps, database, sicurezza web e Docker."
          ]
        },
        {
          "title": "ISIS Facchinetti",
          "subtitle": "Diploma in Manutenzione e Assistenza Tecnica",
          "date": "2022"
        }
      ]
    },
    {
      "type": "facts",
      "title": "Competenze",
      "items": [
        { "label": "Backend & Data", "value": "C#, .NET, ASP.NET Core, Entity Framework Core, LINQ, REST API, SQL Server, PostgreSQL/PostGIS, Redis" },
        { "label": "Architettura & Test", "value": "Clean Architecture, CQRS, SignalR, Hangfire, OpenAPI, Serilog, OpenTelemetry, xUnit, Moq, Testcontainers" },
        { "label": "Frontend & Mobile", "value": "TypeScript, JavaScript, React, Next.js, Tailwind CSS, HTML/CSS, Flutter, Dart, Riverpod, React Native (Expo)" },
        { "label": "Cloud & DevOps", "value": "Azure, Google Cloud, AWS, Firebase, Vercel, Cloudflare Workers, Docker" },
        { "label": "Strumenti", "value": "GitHub Actions, Azure DevOps, Git/GitHub, GitLab, Stripe, OAuth/PKCE, MCP, Node.js, Jira, Figma, Linux" },
        { "label": "Esperienza aggiuntiva", "value": "Angular, Vue, Blazor/.NET MAUI, WordPress, PHP/Drupal, Odoo, MongoDB" }
      ]
    },
    {
      "type": "facts",
      "title": "Lingue",
      "items": [
        { "label": "Cinese", "value": "Madrelingua" },
        { "label": "Italiano", "value": "Bilingue" },
        { "label": "Inglese", "value": "A2 / base" }
      ]
    }
  ],
  "footnote": "Autorizzo il trattamento dei dati personali contenuti nel mio curriculum vitae ai sensi del Regolamento UE 2016/679 (GDPR)."
}
